{
  "version": 1,
  "status": "prototype-fixtures-not-execution-contracts",
  "branches": [
    {"id":"fixture.appearance","node":"fixture-appearance","kind":"branch","tool":"System","interface":"Appearance","label":"Appearance controls","description":"Choose light, dark, wallpaper, accent colors or conditional desktop themes.","icon":"palette","children":["appearance.light","appearance.dark","appearance.open","theme.pick","appearance.wallpaper","appearance.accent","appearance.auto"]},
    {"id":"fixture.sound","node":"fixture-sound","kind":"branch","tool":"System","interface":"Sound","label":"Sound controls","description":"Volume, mute, outputs, microphone, alerts and conditional per-app sound.","icon":"volume","children":["sound.volume","sound.output","sound.input","sound.mute","sound.microphone_mute","sound.apps","sound.alerts"]},
    {"id":"fixture.display","node":"fixture-display","kind":"branch","tool":"System","interface":"Display","label":"Display controls","description":"Brightness, night colors, resolution, scale, layout, refresh, HDR and mirroring when supported.","icon":"display","children":["display.brightness","display.open","display.night","display.resolution","display.scale","display.arrange","display.refresh","display.hdr","display.orientation","display.mirror","display.external_brightness"]},
    {"id":"fixture.network","node":"fixture-network","kind":"branch","tool":"System","interface":"Network","label":"Connection controls","description":"Wi-Fi, Bluetooth, VPN, Ethernet, hotspot, airplane mode, proxies and DNS.","icon":"wifi","children":["network.wifi","network.bluetooth","network.vpn","network.ethernet","network.airplane","network.hotspot","network.proxy","network.dns","network.forget","network.sharing"]},
    {"id":"fixture.notifications","node":"fixture-notifications","kind":"branch","tool":"System","interface":"Notifications","label":"Notification controls","description":"Do Not Disturb, notification preferences and conditional focus schedules.","icon":"bell","children":["notifications.focus","notifications.open","notifications.apps","notifications.schedule"]},
    {"id":"fixture.session","node":"fixture-session","kind":"branch","tool":"System","interface":"Session","label":"Session controls","description":"Lock, sleep, sign out, switch user, restart or shut down. Preview only; never immediate execution.","icon":"lock","children":["system.lock","session.sleep","session.logout","session.switch_user","session.restart","session.shutdown","session.login_items","session.timeout"]},
    {"id":"fixture.power","node":"fixture-power","kind":"branch","tool":"System","interface":"Power","label":"Power and battery","description":"Power preferences, battery status and conditional energy profiles or charge limits.","icon":"power","children":["system.power","power.profile","power.battery","power.charge_limit"]},
    {"id":"fixture.input","node":"fixture-input","kind":"branch","tool":"System","interface":"Input","label":"Keyboard and pointer","description":"Keyboard layouts, repeat, shortcuts, mouse, touchpad and keyboard backlight where supported.","icon":"sliders","children":["input.layout","input.repeat","input.shortcuts","input.mouse","input.touchpad","input.keyboard_brightness"]},
    {"id":"fixture.accessibility","node":"fixture-accessibility","kind":"branch","tool":"System","interface":"Accessibility","label":"Accessibility controls","description":"Screen reader, zoom, contrast, text size, color filters, motion and keyboard assistance.","icon":"sliders","children":["accessibility.open","accessibility.reader","accessibility.zoom","accessibility.contrast","accessibility.text","accessibility.colors","accessibility.motion","accessibility.keyboard"]},
    {"id":"fixture.privacy","node":"fixture-privacy","kind":"branch","tool":"System","interface":"Privacy","label":"Privacy and permissions","description":"Review microphone, camera, location, screen-capture permissions and firewall settings. No grants inferred.","icon":"shield","children":["privacy.open","privacy.microphone","privacy.camera","privacy.location","privacy.screen","privacy.firewall"]},
    {"id":"fixture.maintenance","node":"fixture-maintenance","kind":"branch","tool":"System","interface":"Maintenance","label":"Apps and maintenance","description":"Settings, files, clipboard, storage, trash, processes, default apps, updates and installed applications.","icon":"folder","children":["system.settings","files.open","clipboard.open","maintenance.storage","maintenance.trash","maintenance.processes","maintenance.defaults","maintenance.updates","maintenance.apps"]},
    {"id":"fixture.desktop","node":"fixture-desktop","kind":"branch","tool":"System","interface":"Desktop","label":"Desktop and workspaces","description":"Virtual desktops, window layout and conditional Hyprland or Omarchy bar and binding preferences.","icon":"workspace","children":["desktop.workspaces","desktop.move_window","desktop.tile","desktop.float","desktop.bar","desktop.bindings","desktop.idle"]}
  ],
  "items": [
    {"id":"appearance.light","tool":"System","interface":"Appearance","label":"Switch to light mode","description":"Use the operating system's light appearance or an installed light desktop theme.","icon":"sun","support":{"macos":"System Settings > Appearance: Light.","windows":"Settings > Personalization > Colors: Light.","linux":"GNOME or KDE appearance settings; other desktops require an explicit backend.","omarchy":"An installed Omarchy theme with a light scheme is required; not a universal toggle."}},
    {"id":"appearance.dark","tool":"System","interface":"Appearance","label":"Switch to dark mode","description":"Use dark appearance or an installed dark desktop theme.","icon":"moon","support":{"macos":"System Settings > Appearance: Dark.","windows":"Settings > Personalization > Colors: Dark.","linux":"GNOME or KDE appearance settings; desktop support varies.","omarchy":"An installed Omarchy theme with a dark scheme is required."}},
    {"id":"appearance.open","tool":"System","interface":"Appearance","label":"Open appearance settings","description":"Find theme, color, wallpaper and appearance controls.","icon":"sliders","support":{"macos":"System Settings > Appearance.","windows":"Settings > Personalization.","linux":"Installed desktop's appearance settings; no common Linux settings application.","omarchy":"Omarchy theme menu; installed version and themes must be checked."}},
    {"id":"theme.pick","tool":"Omarchy","interface":"Themes","label":"Choose an Omarchy theme","description":"Browse installed Omarchy themes; the requested scheme must actually exist.","platforms":["omarchy"],"icon":"palette","support":{"omarchy":"Omarchy theme menu / omarchy-theme-set, only if installed. Theme names must come from discovery."}},
    {"id":"sound.volume","tool":"System","interface":"Sound","label":"Adjust volume","description":"Open output volume controls.","icon":"volume","support":{"macos":"System Settings > Sound or Control Center.","windows":"Settings > System > Sound.","linux":"Desktop sound settings; pactl or wpctl only with a matching audio service.","omarchy":"PipeWire/WirePlumber volume controls if installed."}},
    {"id":"sound.output","tool":"System","interface":"Sound","label":"Choose audio output","description":"Choose speakers, headphones or another sound output device.","icon":"volume","support":{"macos":"Sound > Output; devices must be enumerated.","windows":"Sound > Output; devices and drivers must be available.","linux":"PipeWire or PulseAudio device selection requires backend discovery.","omarchy":"WirePlumber or desktop audio picker; actual device IDs must be discovered."}},
    {"id":"sound.input","tool":"System","interface":"Sound","label":"Choose microphone input","description":"Open microphone selection and input level controls.","icon":"mic","support":{"macos":"Sound > Input; access to capture is a separate permission.","windows":"Sound > Input; recording permission is separate.","linux":"Desktop sound settings or an installed PipeWire/PulseAudio backend.","omarchy":"WirePlumber input device controls when available; no recording grant."}},
    {"id":"display.brightness","tool":"System","interface":"Display","label":"Adjust brightness","description":"Open brightness controls when the display hardware supports them.","icon":"sun","support":{"macos":"Displays settings for supported built-in/Apple displays; arbitrary external monitors need a separate backend.","windows":"Display brightness slider only on supported displays/drivers.","linux":"Desktop settings or brightnessctl when a backlight device and permissions exist.","omarchy":"Supported backlight device via installed brightness controls; not arbitrary external monitors."}},
    {"id":"display.open","tool":"System","interface":"Display","label":"Open display settings","description":"Find resolution, scaling and multiple-display arrangement.","icon":"display","support":{"macos":"System Settings > Displays.","windows":"Settings > System > Display.","linux":"GNOME/KDE display settings, or a compositor-specific backend.","omarchy":"Hyprland monitor configuration; inspect actual monitors and config before changes."}},
    {"id":"display.night","tool":"System","interface":"Display","label":"Adjust night light","description":"Open warm screen colors, Night Shift or Night Light where available.","icon":"moon","support":{"macos":"Displays > Night Shift on supported systems.","windows":"Display > Night light when supported by the display driver.","linux":"GNOME Night Light, KDE Night Color, or an explicitly installed equivalent.","omarchy":"An installed compatible color-temperature service such as hyprsunset; not assumed present."}},